{"coordinate_system":"decoded_utf8","coverage_basis":"parser_ir.nodes[*].span","covered_eligible":[{"end":25,"start":0}],"covered_eligible_bytes":25,"decoded_source":{"bytes":58,"encoding":"utf-8","sha256":"sha256:f52fa5a06842f566238c15c2327f5f2e4ffe43a6e7ae4d6fd7bab8ad4449549c"},"decoded_source_bytes":58,"diagnostics":{"bytes":30,"locator":"sha256/cb/cbcf478055ab88b7988cb3265af26233f62a1cf05130e9680cbae2072336af3d.json","media_type":"application/json","profile":"abc/raw-parser-diagnostics-schema-v3","sha256":"sha256:cbcf478055ab88b7988cb3265af26233f62a1cf05130e9680cbae2072336af3d"},"eligible":[{"end":58,"start":0}],"eligible_bytes":58,"errors":[],"identity_ref":"sha256:6f365a44b975465943da88d0e3fe4f123672e00913285a3e998ab465bc79edca","ignored":[],"ignored_bytes":0,"instrument_version":"parser-rq-source-accountability-v1","original_source":{"bytes":58,"sha256":"sha256:f52fa5a06842f566238c15c2327f5f2e4ffe43a6e7ae4d6fd7bab8ad4449549c"},"parser_ir":{"bytes":2671,"schema_hash":"sha256:43a6a6d86ca5eca062508e6cae633d19bf5248f15c5bb46153a6d8580ea916ec","schema_id":"https://w3id.org/abc/schemas/parser-ir.schema.json","sha256":"sha256:0a2d372c3ef8782fc21b0740d6d0bcf494ae4b8f379b092a7ee6f1c4107dbeaf"},"schema_version":"abc/parser-rq-source-accountability-work/v1","status":"ok","taxonomy_hash":"sha256:8d83b3f2693817e6a32fbcc5dd355cd4d45c11d008450f6d22faa4f5f8061a0c","taxonomy_version":"parser-rq-ignored-regions-v1","uncovered_eligible":[{"end":58,"start":25}],"uncovered_eligible_bytes":33,"work_id":"000002_2"}