{
  "schema_version": "abc/parser-rq-source-accountability-work/v1",
  "identity_ref": "sha256:aaaaaaaaaaaaaaaaaaaaaaaaaaaaaaaaaaaaaaaaaaaaaaaaaaaaaaaaaaaaaaaa",
  "instrument_version": "parser-rq-source-accountability-v1",
  "work_id": "w1",
  "original_source": {"sha256": "sha256:1111111111111111111111111111111111111111111111111111111111111111", "bytes": 3},
  "decoded_source": {"sha256": "sha256:2222222222222222222222222222222222222222222222222222222222222222", "bytes": 3, "encoding": "utf-8"},
  "parser_ir": {"schema_id": "https://w3id.org/soranoha/schemas/parser-ir.schema.json", "schema_hash": "sha256:3333333333333333333333333333333333333333333333333333333333333333", "sha256": "sha256:4444444444444444444444444444444444444444444444444444444444444444", "bytes": 100},
  "diagnostics": {"profile": "abc/raw-parser-diagnostics-schema-v3", "sha256": "sha256:5555555555555555555555555555555555555555555555555555555555555555", "bytes": 2, "media_type": "application/json", "locator": "blobs/sha256/55"},
  "taxonomy_version": "parser-rq-ignored-regions-v1",
  "taxonomy_hash": "sha256:bbbbbbbbbbbbbbbbbbbbbbbbbbbbbbbbbbbbbbbbbbbbbbbbbbbbbbbbbbbbbbbb",
  "coordinate_system": "decoded_utf8",
  "coverage_basis": "parser_ir.nodes[*].span",
  "status": "ok",
  "ignored": [],
  "eligible": [{"start": 0, "end": 3}],
  "covered_eligible": [{"start": 0, "end": 2}],
  "uncovered_eligible": [{"start": 2, "end": 3}],
  "decoded_source_bytes": 3,
  "ignored_bytes": 0,
  "eligible_bytes": 3,
  "covered_eligible_bytes": 2,
  "uncovered_eligible_bytes": 1,
  "errors": []
}
